,0
355,"The	Indian	National	Congress	will	ensure that all laws for the welfare of children including the Child Labour (Prohibition and Regulation) Act and the Protection of Children from Sexual Offences Act, 2012,	will	be	strictly	enforced."
356,"We will further strengthen and expand the scope of the National Commission for	Protection	of Child	Rights,	set	up	in 2007."
357,We will also ensure that the strongest possible	action	is	taken	to	prevent	child trafficking.
358,The quality of the Integrated Child (ICDS) Development improved programme will be vastly and special incentives will be given to Anganwadi	workers.
359,Scheme Fast-Track Courts will be established with ‘in-camera’ proceedings facilities in State headquarters and in regional centres.
360,The purpose of these Courts will be solely to address crimes against women.
361,Mandatory procedure for the rapid	conclusion	of cases	where	custody of children is involved shall be put in place.
362,"We will increase the number of girls hostels, particularly in tribal areas and hostels	for	working	women,	with	day	care, to encourage women to become well- educated	and	earn	their	own	livelihood."
363,psycho-social aid in cases of rape and domestic	violence	against	women.
364,"The	Indian	National	Congress,	true	to	its long-standing	history,	will	take	measures to enable increased participation and reservation	for	women	at	all	levels	within the government."
365,"We will ensure that at least	25%	of the	total	police	officers,	sub- inspectors	and	constables	at	every	police station in the country will be women, over the next five years."
366,We will ensure the	number	of women	police	stations	in the	country	goes	up	from	500	to	2000	in the	next	five	years.
367,The deTailed aCTion plan 2014 -2019 The Indian National Congress at earmark will least 30% of all flowing funds Panchayats into and Nagarpalikas development for of women and children and focus special on needs of female agricultural labour and women	cultivators.
368,"the We will encourage the setting up of “Poorn Shakti Kendras” at block level to provide a single window mechanism for awareness, information, access and utilisation of government schemes and programmes."
369,"The	Indian	National	Congress	will	provide land rights for women especially single women, women-headed households, land for women whose husbands have migrated	away	from	villages."
370,"The is Indian National Congress committed to the enactment of the Women’s Reservation Bill to reserve 33	%	of all	seats	in	the	Lok	Sabha,	and	in all	State	legislative	assemblies	for	women."
371,We will initiate immediate action to formulate	a	Citizens	Charter	for	Women’s Safety	and	Security.
372,The	Indian	National	Congress	has	placed a high premium on the education of women.
373,"We	will	continue	with	this	focus, to	achieve	gender	parity	in	literacy."
374,We	will	ensure	that	all	measures	are	taken to	make	women	feel	safe	and	protected.
375,"We will expedite such measures as the creation of functional helplines in all major	towns	and	cities	and	rural	areas	for prompt grievance redressal for women, exclusive	24-hour	transport	facilities	and gender	sensitivity	classes	for	police	men and women, particularly in registering and investigating complaints made by women."
376,"The	Indian	National	Congress	will	open “One	Stop	Crisis	Centres”	for	women	in all	hospitals	to	provide	medical,	legal	and 24 25 Through the NRLM we will provide low	interest	loans,	of upto	₹	1	lakh,	to women	for	livelihood	activities."
377,"safeguarding Minorities The	Indian	National	Congress	will	focus	on accelerating concrete, sustainable and long- term plans for the welfare of the Nation’s minorities."
378,The Indian National Congress has always been	at	the	forefront	in	promoting	Schemes for	the	welfare	of minorities.
379,A	separate	and dedicated Ministry of Minority Affairs was established under the Congress-led UPA-I ‘Priority Sector Lending’ disbursement for	minorities	has	steadily	increased.
380,We will continue to ensure that members of the minority communities have easy access to credit and other incentives to encourage like entrepreneurship.
381,"tax rebates etc., For the effective management of Waqf properties	and	in	realisation	of the	specific promise made in 2009, the Congress- led UPA government became the first government	to	pass	a	law	providing	clear guidelines	to	prevent	the	usurpation	and mismanagement of Waqf properties."
382,The	Indian	National	Congress	pledges	to continue	with	this	programme.
383,"the We will work to create a ready corpus, the Maulana lines of along for young Azad Educational Fund entrepreneurs."
384,"development Skills programmes for minorities which have been carried out successfully in various districts,	will	be	implemented	across	the country."
385,"While much work has been done to implement	the	recommendations	of the Sachar Committee, the Indian National Congress will work tirelessly to ensure that every single recommendation is reviewed and efforts are made for their implementation."
386,The deTailed aCTion plan 2014 -2019 The	Indian	National	Congress	will	strive to clear all pending compensations to women	with	missing	husbands	in	areas	of unrest	and	conflict	and	especially	border areas	including	providing	employment	to war widows and their families.
387,"We will institutional strengthen arrangements	to	provide	access	to	credit, training	and	marketing	for	women	in	the unorganised sector in peri-urban and rural areas."
388,"The	Indian National Congress is	deeply distressed with the continued sexual exploitation of tribal girls at various such places, as hostels, and continued trafficking in young women b e l o n g i n g to tribal communities."
389,"This matter receive will the highest priority	and	will	be	taken	up	with	all	State governments	and	special	Schemes	will	be introduced, like through the National Rural Livelihood Mission (NRLM) for securing	their	livelihoods."
390,government.
391,Since then many far-reaching programmes in various sectors have been implemented	with	significant	results.
392,The	Indian	National	Congress	will	work with women’s Self-Help-Groups for the distribution	of free	sanitary	napkins	for adolescent	girls.
393,The Indian National Congress believes that	society	should	be	more	sensitive	to the	rights	of the	transgender	community.
394,This issue will receive separate and continued attention.
395,Numerous have been scholarships distributed to children belonging to the minority community.
396,The Corpus of the Maulana	Azad	Education	Foundation	has been	more	than	tripled	to	over	Rs	700	crore in an attempt to encourage candidates from	the	minority	communities	to	pursue opportunities in higher education.
397,This work will be continued so as to ensure that	no	child	who	applies	for	educational support	is	denied	it	at	any	level.
398,"The Prevention of Communal and Targeted Violence (Access to Justice and Reparations) Bill, 2013, which was drafted and introduced by the Indian National Congress will be passed as a matter	of priority."
399,The Congress-led UPA government has taken steps to address the conditions of backward minorities by aiming to provide them reservation in educational government institutions employment.
400,We	will pursue	this	matter closely in Court and ensure that the policy is implemented through proper legislation.
401,"and in youth and student agenda The	Indian	National will Congress continue to focus on youth capacity building, education, and leadership development."
402,Opening	up	the	political	system and giving a voice to each and every young Indian	will	continue	to	be	a	priority	area.
403,The Indian National Congress believes our youth is our biggest asset.
404,In the past decade not only have we actively encouraged young leadership and political opportunities for all but also remained committed to creating an enabling and rewarding environment to build the	capacity	of our	youth	to	take	on	roles	more actively	in	our	country’s	future.
405,"We	spend	more than ₹ 90,000 crore across various schemes for	the	youth,	and	we	will	only	increase	this."
406,26 27 Building	the	Best	Education	System in	the	World	for	our	Students The Indian National Congress has been unequivocal in its emphasis and support for providing affordable and quality education.
407,We will continue to keep education on the very	top	of our	development	agenda.
408,"is Education the backbone of human development and is vital to ensuring equal social, political and economic opportunities for all citizens."
409,"We enacted the Right to Education Act 2009, which provides for free and compulsory education for children between the ages of 6 and 14 years."
410,"As a result, enrolment of children at the primary education now stage has reached near universal levels."
411,1.98 lakh primary schools and 1.1 lakh	upper	primary schools have been constructed.
412,"Under UPA-I and UPA- II, the per capita public expenditure on education	increased	from	₹	888	in	2004–05 to	₹	2,985	in	2011–12."
413,"Our	focus	will	now be	on	improving	the	quality	of education-	we will move from “Sarva Shiksha Abhiyan” to “Shreshth	Shiksha	Abhiyan.” the The Indian National Congress will implementation of strengthen the Right to Education Act to ensure learning outcomes, adequate quality infrastructure and facilities in schools, regular teacher training and an optimal Pupil	Teacher	Ratio."
414,"We	will	also	ensure quality in teacher training by making suitable	investments	and	amendments	to regulations,	wherever	required."
415,"We will enhance focus and resources on the implementation of the Rashtriya Madhyamik	Shiksha	Abhiyan,	to	improve quality of secondary education."
416,We will achieve near universal enrolment in secondary	education.
417,The	Indian	National	Congress	will	place a special emphasis on reducing the drop-out rate particularly in middle and secondary	levels.
418,The Indian National Congress will take systematic	steps	to	address	issues	relating to discrimination against students from the	North	East	and	Jammu	and	Kashmir.
419,We	will	continue	to	place	a	special	focus on ensuring educational access to civil strife affected areas and the North East region.
420,"To focus on higher education, we launched	the	Rashtriya	Uchhatar	Shiksha Abhiyan (RUSA) to provide strategic funding	to	improve	college	and	university infrastructure."
421,"RUSA	will	help	create	70 new	universities,	provide	infrastructure	in to expand The Indian National Congress will to continue providing interest-free educations loans to students at all levels especially to the weaker	sections	of society."
422,its support The Indian National Congress is commited to exploring the possible partnerships with the private sector in the delivery of education.
423,"New Public Private Partnership models will be explored and appropriate regulatory procedures, systems, policies	and	incentives	will	be	developed, to enable private education providers to take on the challenge of expanding and improving secondary education, in accreditation The deTailed aCTion plan 2014 -2019 particular."
424,"Indian National Congress will establish	a	“National Youth	Commission”, which will be a and professional focal dedicated youth for point development in all aspects."
425,We will establish a centralised students to encourage exchange programme National	unity.
426,Promoting	Sports The Indian National Congress remains sports committed opportunities are expanded and made more available	and	accessible	to	the	youth.
427,ensuring that to We	will	strive	to	be	a	Nation	where	sport	in all	its	forms	is	promoted	and	encouraged.
428,"Due	to	the	UPA-II’s	recent	efforts,	India has	been	reinstated	as	a	member	of the We will establish independent an oversee to regulatory mechanism State and private institutions to ensure standardisation	and	quality	of education."
429,We will support regional and context specific curricula as well focus on developing	life	skills	including	leadership building.
430,We	are	committed	to	the	cause	of special education.
431,We will strengthen facilities for children with special needs and disabilities.
432,We	will	also	award	priority	to developing	infrastructure	for	differently- abled	persons.
433,"current	universities,	upgrade	autonomous colleges	to	Universities,	and	create	a	new model of general degree colleges and professional	institutions."
434,"The	Indian	National	Congress	will	set	up a	“National	Commission	for	Students”,	a body	which	will	protect	and	promote	the interests of students."
435,"This Commission will review Constitutional and legal safeguards for students, recommend remedial legislative measures, facilitate redressal of grievances and advise the government on all policy matters concerning	students."
436,28 29 International Olympic Committee.
437,The Indian National Congress will continue to clean up sports administration.
438,We will	ensure	active	involvement	of former sportspersons	in	sports	administration.
439,The	Rajiv	Gandhi	Khel	Abhiyan	launched by the Congress-led UPA government will be implemented to ensure high quality sporting facilities in every block of the	country.
440,A	“National	Sports	Education	University” will be set up to educate students of exceptional	talent.
441,There	would	be	a	team of experts who would be continuously scouting for talent in every sport across the country in the age-group of 8-15 years.
442,It will have world class coaches and facilities.
443,"youth	in	Railways,	Indian	Army	and	other Central	government	departments."
444,The Indian National Congress remains committed	to	eradicating	the	problem	of drug	abuse.
445,A	nation-wide	assessment	of the prevalence of this problem will be undertaken.
446,Funding will be adequately provided for drug-rehabilitation centres which	will	be	set	up	in	each	district.
447,"The National Service Scheme, launched by the Congress-led UPA government for	graduates,	aims	to	enhance	IT	literacy, financial	literacy,	english	communication and other soft skills; to make the youth rural development and panchayati raj The Indian National Congress will continue to	work	progressively	to	ensure	the	prosperity of rural	India."
448,"In	the	ten	years	of UPA-I	and	UPA-II,	the	rural areas	of the	country	have	seen	unprecedented economic development and improvement in quality	of life."
449,"For	the	first	time	in	over	two decades,	the	increase	in	rural	consumption,	at 18%,	has	outpaced	urban	consumption."
450,Rural poverty declined at 0.7 percentage points per year between 1993-94 and 2004-05.
451,"It declined more than three times faster at 2.3 Accredited Social Health Activist (ASHA) workers and various others, must	have	their	contributions	recognised in a meaningful manner."
452,The Indian National Congress will ensure that they are compensated adequately for their services and have access to high quality training	and	decent	working	conditions.
453,"The	Indian	National	Congress	fulfilled	its promise and implemented the National Food	Security	Act,	a	statutory	guarantee to ensure adequate quantity and quality of food at affordable prices to people to	live	their	life	with	dignity."
454,The	Indian to National Congress will attempt expand focus the of the current food security Schemes to include subsidised pulses and cooking oil for beneficiaries of Antyodaya Anna Yojana.
455,The deTailed aCTion plan 2014 -2019 Other	Youth	Issues The Indian National Congress will promote social and entrepreneurship development among the youth.
456,"inclusiveness, employability The Indian National Congress will provide a special youth development package	(entrepreneurship/employment) for Left-Wing Extremism affected areas with special focus on women and Scheduled	Castes	and	Scheduled	Tribes."
457,We	will	start	a	special	drive	for	recruitment of North East and Jammu & Kashmir more employable.
458,The Indian National Congress is committed to increasing funding	and	reach	of this	Scheme	while prioritising	its	implementation.
459,We will set up government We will seek to ensure priority to differently-abled youth with respect to education	and	employment	opportunities.
460,run facilitation employment centers foreign employment opportunities.
461,These will curtail middlemen/fraudulent help recruiting agencies.
462,The Ministry of Overseas	Indian	Affairs	will	be	the	nodal agency	for	this.
463,for youth exchange/ seeking percentage	points	per	year	in	the	UPA	period between	2004-05	and	2011-12. in terms Farm wages increased real impressively after 2004 to reach ₹184.7 in 2012-13.
464,"Our flagship and per day historic programme, the Mahatma Gandhi National Rural Employment Guarantee Act (MGNREGA) has been a significant contributor	in	this;	on	an	average	1	in	every 4 rural households has sought work under MGNREGA	every	year."
465,"All development functionaries at the village level who perform vital nation- building tasks like Anganwadi workers, (ANMs), Auxiliary Nurse Midwives The Indian National Congress will implement a Universal	Pension	Scheme,	for	the	elderly, destitute, widows and other similar groups	(based	on	certain	exclusions)."
466,We will expand the current Pradhan Mantri Gram Sadak Yojana (PMGSY) to ensure that an all-weather road will connect	all	habitations	with	a	population of 125	persons	and	above.
467,"To promote effective access to clean drinking water and water for irrigation, we will set up a legal and institutional framework, in discussion and with consensus of States, for water."
468,We will 30 31 also ensure 100% coverage of rural habitations	for	drinking	water	in	the	next five	years.
469,We will continue to support Self-Help- Groups (SHGs) and assist the poor to set up small businesses.
470,We will set up more branches of the Bharatiya Mahila Bank and women only branches of other public sector banks.
471,Our target is to ensure the formation of 7	crore	SHGs	by	2019.
472,The	Indian	National	Congress	will	ensure 100% modernisation and digitisation of land records to ensure transparency in land titles.
473,"c.	Gram Sabhas are strengthened and legally	mandated	to	secure	responsible and	responsive	local	government; d.	The	individual	citizen	is	empowered	to secure, through the local Panchayat, his	or	her	rights	and	entitlements	and other benefits provided for in the Constitution."
474,"agriculture and farmer Welfare The Indian National Congress will continue to	provide	an	impetus	to	agricultural	growth, productivity and incomes."
475,We will also stay focused	on	providing	all	possible	support	for facilities	and	ware	housing.
476,It	will	ensure that	the	farmer	gets	a	much	higher	value for	her	or	his	produce.
477,"for We will continue to nurture Public increasing Private Partnerships investments	in	value-chains,	cold	storage facilities, grading and standardisation, quality	certification	and	warehouses."
478,This will greatly aid in increasing agriculture productivity	and	exports.
479,"We	will	add	1	crore	hectares	to	irrigated area by completing the radical Water Reforms	Agenda	of the	12th	Plan,	which is based on Irrigation Management particularly	in	regions	where	groundwater depletion	has	taken	place."
480,Small and marginal farmers own more than half the country’s total cattle and buffalo.
481,"However,	only	12%	of the	total expenditure	on	agriculture	is	on	livestock development."
482,"The Indian National Congress	will	place	a	special	emphasis	on livestock,	fisheries,	opening	of veterinary schools	and	centres,	fodder	development through animal husbandry programmes and like MGNREGA."
483,MGNREGA will also be harnessed to support the construction of poultry shelters	and	water	bodies	for	fisheries.
484,"schemes The deTailed aCTion plan 2014 -2019 The Indian N a t i o n a l Congress will s u b s t a n t i a l l y i n c r e a s e P a n c h a y a t f u n d i n g , of especially untied	funds."
485,"We will also encourage Panchayats to raise their own resources so that Panchayat representatives,	in	consultation	with	Gram and Ward Sabhas, can themselves decide how	and	on	what	to	spend	their	money."
486,"We will set up a “National Panchayati Raj	Commission”,	with	branches	in	each State	and	Union	Territory,	so	that: a. Probity and transparency is ensured in the functioning of Panchayats and their	elected	representatives; b. Panchayati Raj functions in line with the Constitution and the laws of the land,	especially	in	tribal	areas	covered by	Panchayat	Extension	to	Scheduled Areas	Act	(PESA); our farmers, in particular women and small and	marginal	farmers."
487,The	Indian	National	Congress	has	instituted schemes like the Rashtriya Krishi Vikas Yojana.
488,"As a result of these measures, the agriculture	GDP	growth	went	up	from	2.6% (under	the	NDA)	to	3.1%	under	UPA-I	and further	to	4%	under	UPA-II."
489,"The historic decision by the Congress- led UPA government to allow Foreign Direct Investment in multibrand retail will transform the agrarian economy as it	will	create	a	beneficial	value	chain	from farm-to-fork,	creating	rural	infrastructure for	sorting,	grading,	packing,	cold	storage Transfer	to	Water	Users	Associations	of farmers."
490,This	will	ensure	Gross	Irrigated Area	crosses	10	crore	hectares	in	India.
491,The current water use efficiency in irrigation is 40%.
492,The Indian National Congress will actively support more efficient	water	use	technologies	including reuse and recycling of water.
493,"We will complete the historic aquifer-mapping and groundwater management programme launched by UPA-II over the	next	five	years,	to	ensure	sustainable utilisation of groundwater to secure the	livelihoods	of lakhs	of our	farmers, the 32 33 The Indian National Congress will	increase	spending to ensure access and quality in agriculture education, including increasing the amount and number of post- scholarships matric and research fellowships for veterinary students."
494,"for The Indian National Congress will insurance increase coverage of crop schemes, particularly among the small and marginal farmers and non-loanee farmers."
495,"Settlement of claims on time, better	crop	yield	estimation	to	determine premiums etc., and involvement of private	sector	will	be	other	areas	of focus."
496,The Indian National Congress will allocate special funds for agricultural research to develop new technologies the Special emphasis will be given for competitiveness of enhancing manufacturing.
497,We will encourage the allotment of land from existing land banks for priority sectors to provide an impetus	to	manufacturing.
498,A	patent	pool	will	be	created	which	will ensure	that	the	Indian	small	and	medium enterprises	are	able	to	access	world-class technology	at	affordable	cost.
499,The Indian National Congress will introduce the Goods and Services Tax Bills and a new Direct Tax Code Bill in Parliament and ensure they are enacted within one year.
500,"We will also announce a Jobs	Agenda,	with	a focus on attracting investments new creation, for 100 days within of government formation."
501,"job for disease management of crops and of livestock, crops,	etc."
502,"high-yielding-varieties The Indian National Congress will conservation promote resource technologies and agriculture practices like integrated farming, organic farming and develop wastelands for dry land farming."
503,"We will cover 250 lakh hectares as watersheds, as part of the dramatically reformed Watershed Integrated Management Programme launched by UPA-II."
504,The	Indian	National	Congress	has	more than doubled the Minimum Support Prices	(MSP)	for	farmers	for	wheat	and paddy	from	2004-05	to	2013-14.
505,The	MSP for	other	cereals	increased	three-fold.
506,We will continue our endeavour to provide higher MSP to increase profitability of agriculture	for	our	farmers.
507,The Indian National Congress will provide concessional loans to groups/ collectives	of small	and	marginal	farmers and women farmers upto ₹ 5 lakh to enable them to gain better access to inputs	and	services.
508,We are aware that the deceleration in investment in manufacturing has been a serious concern.
509,We propose to take strong measures to promote the manufacturing industry.
510,"Utmost priority will be given to the implementation the National of Manufacturing Policy to enhance the share	of manufacturing	in	GDP	to	25%	by 2022,	which	will	be	achieved	by	an	annual growth	rate	for	the	sector	in	the	range	of 12-14%."
511,We are committed to creating National Investment Manufacturing Zones	as	greenfield	integrated	industrial townships	to	make	India	a	manufacturing hub of the world.
512,16 new world-class are There of lakhs families in our belts coastal depend that fishing on for their livelihood.
513,"To enhance their welfare, a new Ministry	of Fisheries	will	be	established and all steps will be taken to further enhance	their	livelihood	security."
514,"The Indian National Congress, honouring	the	commitment	made	in	the 2009 Manifesto, enacted the Right to Fair Compensation and Transparency in Land Acquisition, Rehabilitation and Resettlement Act, 2013."
515,"The Indian National Congress will ensure fast and fair implementation of the Act such that farmers, landowners and livelihood losers get adequate compensation for their	acquired	land."
516,"The deTailed aCTion plan 2014 -2019 The	Indian	National	Congress	will	strive to lower interest rates for farmers to ensure	they	are	able	to	access	extension services	and	agriculture	inputs	like	seeds, water,	fertilizers	etc."
517,accelerating industrial and Manufacturing growh The Indian National Congress commits to 10%	growth	in	manufacturing	and	an	increase in contribution of manufacturing sector’s share	to	25%	of GDP.
518,We	will	also	support rapid	acceleration	in	exports.
519,cities have already been notified across the	country.
520,The Indian National Congress is committed to the creation of industrial corridors	to	catalyse	economic	growth	and give	a	focused	thrust	to	manufacturing	in the	country.
521,The	Delhi-Mumbai	Industrial Corridor has decisively moved into the implementation phase.
