,0
0,The open ManifesTo proCess: paThbreaking poliTiCal reforM The	Indian	National	Congress	has	pioneered	an	entirely	new	way	in	which political	party	election	manifestos	are	prepared.
1,It	is	our	firm	belief that	the Indian	National	Congress	Manifesto	must	reflect	the	voice	and	aspirations	of the	people	and	a	new	vision	for	the	country.
2,"There	were	several	consultations	held	across	the	country	over	a	five-month period	(from	October,	2013	to	March,	2014)	with	different	stakeholders,	to get	their	inputs	on	India’s	future	growth,	development	and	inclusion	agenda."
3,"The	Congress	Vice	President	Shri	Rahul	Gandhi	participated	in	several	of these	interactions	including	those	with	representatives	from	Scheduled	Castes, Scheduled	Tribes,	Other	Backward	Classes,	minorities,	women	organisations, youth,	labour,	industry,	Panchayat	representatives,	ex-servicemen,	railway porters,	rickshaw	pullers,	salt-pan	workers	and	farmers."
4,In	addition	to	this	a dedicated	website	(www.incmanifesto.in)	was	established	to	invite	suggestions from	all	citizens	for	the	Manifesto.
5,A	separate	website	for	the	“National	Student Manifesto”	was	also	created.
6,"We	received	tens	of thousands	of suggestions	through	these	consultations,	on the	websites	and	social	media	platforms,	phones,	emails,	etc."
7,"These	suggestions were	carefully	considered	and	have	been	included,	wherever	feasible."
8,We	believe	this	unique	exercise	has	made	the	Manifesto	inclusive	and	fully reflective	of the	voice	of the	people	of India.
9,"2 • Congress:	The	Only	Choice 4 • Congress	or	BJP • The	UPA	Report	Card 6 • Landmark	Legislation:	2009-2014 8 • Our	Pledge:	A	15	Point	Agenda	for	Socio-economic	and	Political	Transformation 10 14 • The	Detailed	Action	Plan	2014-2019 Table of ConTenTs A New Future for the Hands that Build the Nation Economic Growth • An	Economic	Roadmap	for	2014-2019 • The	Indian	National	Congress’s	100	Day	Agenda	for	Growth • Accelerating	Job	Creation	and	Skill	Development Protecting	the	Interests	of Labour Right	to	Health Empowering	Scheduled	Castes,	Scheduled	Tribes	and	Other	Backward	Classes Women’s	Empowerment	and	Protection	of Children Safeguarding	Minorities Youth	and	Student	Agenda • Building	the	Best	Education	System	in	the	World	for	our	Students • Promoting	Sports • Other	Youth	Issues Rural	Development	and	Panchayati	Raj Agriculture	and	Farmer	Welfare Accelerating	Industrial	and	Manufacturing	Growth Infrastructure • Transport • Energy Urban	Development Housing Environment Innovation,	Information	and	Communication	Technology Fighting	Corruption Governance	Reforms • Electoral	Reforms • Legal	and	Judicial	Reforms • Police	Reforms Internal	Security Defence	and	Welfare	of Ex-Servicemen Foreign	Policy • An	Appeal 14 14 15 16 17 19 20 21 24 26 27 28 29 30 31 32 34 36 36 37 38 39 40 41 43 43 44 44 44 46 46 47 modernise the Indian economy and bring about the information and conmunications technology	revolution."
10,"In	the	1990’s,	radical economic	reforms	were	instituted	leading	to accelerated	economic	growth	and	widespread economic and social transformation."
11,"At the turn of the millennium, we brought about a “Regime of Rights” marking a paradigm shift in India’s politics and development."
12,"Beginning with the Right to Information, Right to Work (Mahatma Gandhi National Rural	Employment	Guarantee	Act),	Right	to Education and the Right to Food, we have launched	a	radical	progressive	economic	and social	development	discourse."
13,"regional balance, progress in backward areas and a strong conviction that in order to prosper every citizen must have the opportunity to evolve to the best of her or his	ability."
14,Ours	is	a	Nation	of incredible	but often	untapped	talent	that	needs	and	deserves to	be	unleashed.
15,We envision an India where power would have	been	devolved	to	the	grassroots	and	to the	marginalized	so	that	they	can	shape	their own	destiny.
16,"communal harmony, and economic growth and	social	justice,	are	two	sides	of the	same coin	and	must	always	go	hand-in-hand."
17,"The Indian National Congress is the only Party that combines experience and youth, wisdom and exuberance, achievement and ambition."
18,"The	Indian	National	Congress	seeks	a	renewed mandate on the strength of its heritage, its record	of service,	both	in	and	out	of power, and	its	clear	vision	for	the	future."
19,"We envision an India charting a new future rather than rewriting in harmony, not in turmoil; thriving in peace its past; living to The Indian National Congress has made India’s unity, seminal contributions integrity, secular polity and democratic federalism."
20,"We have championed the rights of the	weaker	sections,	created	conditions	for faster economic growth and have been the principal	instrument	of social	and	economic change, the preferred political choice for crores of women and men."
21,"Our	central	values	resonate	the	very	idea	of India,	that	has	come	to	us	over	the	centuries, an India that rejoices in and celebrates its many diversities, and builds on these diversities to strengthen the bonds of unity through secularism, pluralism, inclusion and social	justice."
22,This	is	the	India	that Mahatma Gandhi envisaged.
23,This is	the	India	for	which	our	Freedom Fighters gave their all.
24,This is the India the Indian National Congress has always dedicated itself to.
25,Ours	is	the	one	Party	with a history of a liberal philosophy that has enabled the country to build	strong	political	and	economic institutions and transform itself.
26,"that Cong ress The onl y ChoiCe In the 1950’s, the Indian National Congress put India on the path of industrialisation through the public sector, ensuring both rapid and balanced regional growth across the face of our country."
27,A massive infrastructure for science and technology	was	also	established.
28,"In	the	1960’s, the	Green	Revolution	was	launched	to	make India	self-sufficient	in	food	grains	and	a	direct assault	on	poverty."
29,"In	the	1970’s,	further	gains were	made	through	the	Green	Revolution	and a White Revolution was unleashed that was to	make	India	the	world’s	largest	producer	of milk."
30,"In the 1980’s, economic reforms were launched in response to new challenges, to The depth and breadth of its political and administrative experience makes the Indian National Congress most intrinsically aware and closely associated with the beliefs, and principles	and	need	of the	people	of India."
31,We are the Party that has always believed in the idealism and leadership abilities of the youth.
32,We have remained connected with their aspirations and have been inspired by their	restless	vibrancy.
33,"Our	vision	is	one	of inclusive	and	sustainable growth fuelled by agricultural development, rather	than	suffering	in	conflict;	imbued	with humility,	not	with	arrogance."
34,We	envision	an	India	where	the	government serves the people rather than where people serve	the	government.
35,We	believe	in	a	simple	universal	truth:	equity and	opportunity	for	all.
36,"The Indian National Congress is the only Party	that	believes	that	economic	growth	and 2 3 Since it formation, 128 years ago, the Indian National Congress has spoken for every section of Indian society	and	has	mirrored	India’s	“unity in	diversity”."
37,The Indian National Congress’s secular	and	liberal	ethos	has	a	place for	each	and	every	Indian.
38,Ours	is	an	inclusive	vision.
39,The Indian National Congress stands in sharp contrast to the divisive and disruptive ideology of the BJP.
40,"We have always been the secular and progressive force	in	this	country	and	strived	to	unite all	religions,	castes	and	communities	in	the ideological	battle	against	those	who	would polarize	and	divide	our	society."
41,democratic Constitution Our and institutions	are	the	cornerstone	of Modern India.
42,"All	of us,	who	wish	to	build	a	better India	and	rid	the	country	of poverty	and Aware	of the	challenges	thrown	up	by	the undemocratic	and	exclusionary	politics	of the	BJP,	particularly	in	the	recent	past,	the Indian National Congress is committed to confronting these challenges with determination."
43,"respond by subverting We do not democratic institutions and blocking Parliament	session	after	session,	year	after year."
44,We	do	not	respond	by	turning	people against	each	other	and	lighting	the	fires	of communal	hatred.
45,We	do	not	respond	by Congress	is	the	only	natural	choice	for	the people	of India.
46,Congre ss or bjp Secular Liberal Nationalism vs Narrow-minded Communalism Inclusive Democracy vs Divisive Authoritarianism The BJP’s narrow and communal perspective	denies	equality	to	all.
47,Theirs	is	an	exclusionary doctrine.
48,"corruption,	must	respect	these	institutions and work through them."
49,They are the legitimate in our hands.
50,No individual or authority can replace the values and processes of democratic governance.
51,instruments Peace cannot be constructed on conflict.
52,Societies	cannot	be	built	on	injustice	and hatred.
53,proposing either that the structures of democracy	be	handed	to	one	single	person or	that	they	be	viciously	undermined.
54,"The Indian National Congress responds through legitimate peaceful, democratic and	Constitutional	means."
55,These	are	the pillars	on	which	our	great	Nation	stands.
56,"It is	for	this	reason	that	the	Indian	National 4 5 It	was	the	tireless	campaign	and	vision of Sonia Gandhi, President of the Indian	National	Congress,	that	brought together	and	gave	shape	to	the	United Progressive Alliance (UPA) headed by Prime Minister Dr. Manmohan Singh in	May	2004."
57,"The work of the Congress-led UPA government was appreciated and the people of India	gave	us	a	renewed	mandate,	with	a larger	majority,	in	2009."
58,The	2009	Mandate	was	to	safeguard	and	advance the interests of India’s farmers and create an environment	conducive	to	their	prosperity.
59,This	has	been	achieved	in	substantial	measure.
60,"The 2009 Mandate was for empowering the poor and the marginalized, especially Scheduled Castes, Scheduled Tribes, Other Backward	Classes,	minorities	and	women."
61,This	has	been	achieved	in	substantial	measure.
62,"Chairperson	of the	UPA,	Sonia	Gandhi,	and Prime Minister Dr. Manmohan Singh, has The	2009	Mandate	was	to	open	the	doors	of education and skills, and provide access to The upa reporT Card translated	into	reality	the	pledges	we	made	in May	2009. immense	opportunities	they	hold	out	for	our biggest	asset,	our	youth."
63,"The	2009	Mandate	was	for	socially	inclusive economic growth with a focus on jobs and livelihoods,	and	social	justice."
64,This	has	been	achieved	in	substantial	measure.
65,The 2009 Mandate was to take forward the commitment made by our government in 2004	promising	“A	New	Deal	for	Rural	India.” This	has	been	achieved	in	substantial	measure.
66,This	has	been	achieved	in	substantial	measure.
67,"The	2009	Mandate	was	for	maintaining	peace and security and for fighting the challenges thrown up by undemocratic, divisive and exclusionary	political	and	social	interests."
68,This	has	been	achieved	in	substantial	measure.
69,We let the record speak for itself.
70,"more than the ₹ 7,248 crore it was ten years	ago."
71,"• Today, minorities have 43,52,000 bank accounts in 121 districts of the country."
72,"The	total	volume	of lending	stands	at	₹ 66,500	crore."
73,"Ten	years	ago,	minorities	had 14,15,000	bank	accounts."
74,"The	total	volume of lending	was	just	₹	4,000	crore."
75,"• Today, 41,16,000 women Self-Help- Groups have been credit linked to banks."
76,"Ten	years	ago	it	was	only	9,71,182."
77,"• Today,	the	total	credit	to	small	businesses stands	in	excess	of ₹	5,27,000	crore."
78,"Ten years	ago,	credit	to	small	businesses	stood at	below	₹	80,000	crore."
79,"• Today, the Central Government’s expenditure on education is ₹ 79,451 crore."
80,"Ten years ago, it was ₹ 10,145 crore."
81,"• Today,	the	total	value	of India’s	international trade	stands	at	US	$	800	billion."
82,"Ten	years ago,	it	was	US	$	142	billion."
83,• The Congress-led UPA has brought 14 crore people out of poverty in the last ten years.
84,The rate of poverty decline has tripled as compared to the preceding decade.
85,"This	is	the	greatest	achievement	of the UPA governments, and we are proud of it."
86,"• In the ten years of UPA-I and UPA-II, India achieved an average annual growth rate	of 7.5%."
87,During	the	NDA	tenure	the average	annual	growth	rate	was	5.9%.
88,"• Today, we produce 263 million tonnes of food grains."
89,"Ten years ago, at the end of the	NDA	tenure	its	was	213	million	tonnes of food	grains."
90,"• Today, the installed power capacity is 234,600 MW."
91,"Ten years ago, it was less than	half at	112,700	MW."
92,"• Today, the number of mobile subscribers has	crossed	95	crore."
93,"Ten	years	ago,	it	was a mere 3.36 crore subscribers."
94,Telephone density in rural areas has increased 26 times.
95,"• Today, coal production is 554 million tonnes	per	year."
96,"Ten	years	ago,	it	was	361 million	tonnes	per	year."
97,"• Today,	we	have	389,578	km	of rural	roads under the Pradhan Mantri Gram Sadak Yojana (PMGSY)."
98,"This is more than 7 times the 51,511 km of rural roads ten years	ago."
99,"• Today,	the	Cental	Government’s	spending on healthcare is ₹ 36,322	crore, 5 times 6 7 The Indian National Congress-led UPA government	has	had	an	unmatched	record when	it	comes	to	the	passage	of significant, historic and pathbreaking legislation."
100,The Indian	National	Congress	is	a	Party	that	takes its commitments to the people as sacred.
101,The Party has worked to realise almost all the	promises	made	to	the	people	in	its	earlier Manifestos	and	campaigns: The Indian National Congress led the charge to enact a unique and unprecedented law to safeguard food security for the poorest.
102,The National Food	Security	Act	marked	the	realisation of over	a	decade	of work	and	has	been hailed as a visionary law	by	the	people.
103,"of The seminal Right to Compensation Fair in and Transparency Acquisition, Land and Rehabilitation Resettlement Act, 2013	-	a	key	campaign promise the Indian	National	Congress	in	2009	-	was enacted after two years of nationwide consultations."
104,This law was a historic victory for our brothers and sisters working in the agriculture sector.
105,"The law	ensures	that	land	cannot	be	acquired without land owners consent, promises	up	to	four	times	the	prevailing market	value	as	compensation	and	repeals the	Land	Acquisition	Act	of 1894. the The	Indian	National	Congress	led	the	way in bringing about historic reform with regard to women’s rights in the form of the	Criminal	Law	(Amendment)	Bill,	2013 and the salutary Protection of Women from	Sexual	Harassment	at	Workplace	Act, 2013."
106,These laws made the system more sensitive to the challenges faced by our women.
107,Penalties	have	increased	and	new crimes	were	included	to	make	the	definition more	women	friendly	so	that	the	law	better serves	the	interests	of the	aggrieved.
108,"In a bid to bring greater clarity on the subject, the Congress-led UPA Government enacted a new Companies Act, 2013."
109,"This new law, resulting from comprehensive consultations with all stakeholders	brings	about	radical	changes that will stimulate entrepreneurship, make it easier to start new businesses and Lokayukta Act, 2013 was born out of a determination to give the people a strong, independent authority to act as a watchdog against administrative corruption."
110,This	authority	empowers	the people by giving them a high-powered forum the in bureaucracy	and	the	political	system.
111,"tackle corruption to In	one	earliest	actions	on	being	re-elected, the Congress-led UPA government passed	the	Right	of Children	to	Free	and Compulsory	Education	Act	in	2009."
112,"This law, which guarantees free education in primary schools, also puts in place Act	will	protect	livelihood	rights	of lakhs of street	vendors."
113,"of Employment The Prohibition as Manual their and Scavengers Rehabilitation Act, 2013 not only prescribes stringent punishment for employing manual scavengers but also has	provisions	for	rehabilitation	of these families."
114,An age-old blot on our society will	finally	be	erased.
115,landMark legislaTion: 2009 -2014 encourage Corporate and Responsibility.
116,"Social Mindful that our Nation’s citizens, and particularly our senior citizens, deserve greater security with regard to their pension funds, the Congress-led UPA Government enacted the Pension Fund Regulatory and Development Authority Act, 2013, to establish a regulator to ensure these funds are protected from unscrupulous	individuals."
117,The	Indian	National	Congress	has	always looked to the people for guidance in the discharge of its duties.
118,The Lokpal provisions for minimum standards for the	establishment	of new	neighbourhood schools.
119,"The Indian National Congress, which has been firmly dedicated to the cause of protecting our nation’s environment and forests, enacted the National Green Tribunal Act, 2009 to establish a special fast	track	court	to	hear	disputes	related	to these issues."
120,"The	Indian	National	Congress	piloted	and passed	the	Street	Vendors	(Protection	of Livelihood	&	Regulation)	Act,	2014."
121,"This 8 9 We will endeavour to bring around two- thirds	of our	population	–	the	skilled	hands that build India – into the middle class, through a package of basic rights for all workers	–	formal	and	informal,	organized and unorganized, regular and contractual."
122,Our aim will be to provide them and all low-income families with economic security	and	a	minimum	standard	of living to uplift their condition.
123,The charter of minimum socio-economic rights we will put	in	place	includes: a.
124,Right	to	Health b.
125,"Right	to	Pension c. Right	to	Homestead	or	Housing d. Right	to	Social	Security e. Right	to	Dignity	and humane	working conditions To support the Right to Health, the Indian National Congress will increase health expenditure to 3% of GDP and provide universal and quality health care for all Indians (including free medicines)."
126,"To support the right to homestead/ housing, we will ensure affordable and quality housing for all."
127,The Indira Awaas Yojana	and	the	Rajiv	Awaas	Yojana	will	be expanded	to	cover	all	poor	rural	and	urban households.
128,"Continuing	our	record	of delivering	India’s highest	growth	rates,	we	will	restore	India to	8%	plus	growth	rate	within	3	years: India a world leader in agricultural production and agro-industry, taking advantage	of our	national	endowments and the genius of our farmers."
129,"We will focus on increasing agriculture productivity and farmer incomes by increasing investments in irrigation, agricultural value chains, cold storage and	warehousing,	etc."
130,f. We will introduce the Goods and Services Tax Bills and a new Direct Tax	Code	Bill	in	Parliament	and	ensure they	are	enacted	within	one	year.
131,g. We will ensure that the unpredictable risk	of retroactive	taxation	is	avoided.
132,"h. We will invest more than 1 trillion k. We will ensure that growth is socially responsible, and comes from genuine value	addition,	not	from	stripping	our natural	resources	or	from	underpaying our	labour."
133,l. We will ensure that all our towns and Gram Panchayats are connected with high-speed broadband connectivity within 18 months.
134,m. Serious and systematic efforts have been made by the Congress-led UPA government	to	track	down	and	recover black money.
135,This determined effort will	continue	unabated.
136,We	will	appoint a	Special	Envoy	to	pursue	this	agenda.
137,We will provide skills- training	to	10	crore	youth and provide them with employment	opportunities over	the	next	5	years.
138,We	will	ensure	that	every citizen	has	a	bank	account within	the	next	five	years.
139,"f. Right to Entrepre- neurship that will protect and assist all those who seek to become	entrepreneurs our pledge: a 15 poinT agenda for soCio-eConoMiC and poliTiCal TransforMaTion rights the new supplement These will other rights established under UPA-I and UPA-II - Right to Food; Right to Information;	Right	to	Education;	Right	to Employment; Rights to fight corruption (Lokpal and Lokayuktas Act as well as Whistleblower Protection Act); Right to Identity	(Aadhaar)	and	the	Right	to	direct receipt of welfare benefits (Aapka Paisa, Aapke	Haath	–	Direct	Benefits	Transfers)."
140,"Together, these rights will provide an economic platform for people below the middle class to transform their lives and to	transform	India	primarily	through	their own effort, not through any handouts of the	government."
141,a.
142,We	will	ensure	that	India	has	a	globally competitive business and investment- friendly	environment.
143,b.
144,We will continue to take firm action to control inflation even in a difficult global	economic	scenario.
145,"c. We will promote an open and competitive economy, open to global and	domestic	competition."
146,d. Our	vision	is	building	India	as	the	world leader	in	manufacturing.
147,We	will	ensure a	10%	growth	rate	in	the	manufacturing sector	with	a	special	emphasis	on	small and	medium	enterprises.
148,"e. We	will	continue	on	the	path	of making dollars over the next decade on upgrading India’s power, transport and	other	development	infrastructure."
149,"We will support more transparent, competitive	and	better-regulated	Public Private	Partnerships	for	both	hard	and soft	infrastructure	development."
150,i.
151,"We	will	promote	a	more	flexible	labour policy as needed for maintaining competitiveness,	while	moving	towards international labour standards for our workers."
152,j.
153,"We will promote greater integration with	the	global	economy	and	encourage Foreign Direct Investment, especially in	labour	intensive	sectors."
154,We will implement the National	Youth	Policy	that	sets	a	new	vision for	leadership	development	amongst	youth and	for	the	development	of sports.
155,We	will bring	enhanced	focus	on	education	for	our youth	and	our	students.
156,a.
157,We will expand higher education opportunities	with	a	focus	on	students from	low-income	families.
158,b.
159,We	will	scale	up	skill	development	and training	to	open	up	new	opportunities for	upward	economic	mobility	for	our people.
160,c. We	will	open	up	our	higher	education system investment from India and from abroad and bring the best to 10 11 the Scheduled Castes and Scheduled Tribes Sub Plans to ensure focused spending	of funds	on	weaker	sections.
161,b.
162,"We will ensure the passage of the Scheduled Castes and Scheduled (Prevention of Atrocities) Tribes Amendment	Bill,	2013."
163,"We will strongly protect the interests of the Other Backward Classes, especially those amongst them that are most deprived."
164,We will establish a new commission	to	inquire	into	the	condition of the most backward and marginalized Other	Backward	Class	communities	who have	not	adequately	received	the	benefits income housing and making investments especially	in	multi-modal	transport.
165,"larger infrastructure, in urban We will accelerate governance reform including legal, judicial and electoral reform, building on the momentum of the last few months."
166,a.
167,We will enact the remaining anti- corruption and accountability bills that	were	blocked	by	the	opposition; b.
168,"We will the ensure immediate passage of The Right of Citizens for Time Bound Delivery of Goods and Services and Redressal of their Grievances Bill, Prevention of and	monitored	at	every	step."
169,e. We	will	develop	a	consensus	and	bring about	legislative	amendments	towards effective and meaningful electoral reforms.
170,"We	are	committed	to	a	series	of specific legislative, administrative and regulatory measures to protect our environment, an endowment entrusted to us for the benefit	of future	generations."
171,"We	will	set up a National Environmental Appraisal and Monitoring Authority (NEAMA), a professional to conduct environmental	appraisals	in	a	time-bound and	transparent	manner."
172,agency our pledge: a 15 poinT agenda for soCio-eConoMiC and poliTiCal TransforMaTion available knowledge and teaching to our	youth.
173,"d. We will move our focus from ‘Sarva Shiksha	Abhiyan’	to	‘Shreshth	Shiksha Abhiyan’, making “quality” the centre of our	agenda e. We	will	strengthen	the	implementation of the Right to Education, ensure secondary universal enrolment education, and reduce drop-out rates in	middle	and	secondary	levels."
174,in The protection of minorities is at the core of the ethos of our country.
175,"The Communal Violence Bill, which was drafted and introduced by the Indian National Congress, remains an important We commitment."
176,will work towards its enactment at the earliest.
177,"We will continue our focus	on	empowerment of women	and	fight	for their	security	(suraksha), self-respect and dignity (samman), and equality	(samanata)."
178,a.
179,We will ensure the passage of the of government programmes; and will recommend	corrective	measures.
180,b.
181,We will Women’s	Reservation	Bill.
182,initiate immediate action to formulate a Citizen’s Charter for Women’s	Safety	and	Security.
183,c. We	will	provide	upto	Rs	1	lakh	as	low interest	loans	to	women	through	Self- Help-Groups	for	livelihood	activities.
184,We will enhance legal protection and resource allocation for the Scheduled Castes	and	Scheduled	Tribes.
185,a.
186,We will enact central legislation on We will the strengthen legal and institutional framework to protect our children.
187,We will improve the working conditions of Anganwadi and related workers	in	whose	care	our	nation	entrusts our most precious asset – our youngest citizens.
