,0
188,"We will give a major to planned urbanization, creating inclusive revamping urban governance, cities, low- empowering mayors, increasing impetus Bribery of Foreign Public Officials and Officials of Public International Organisations Bill, Prevention of Corruption (Amendment) Bill, The Judicial Public Procurement Bill, Standards	and	Accountability	Bill	and the	Judicial	Appointments	Bill."
189,"c. We	will	implement	a	strategy	for	legal and judicial reform that will enhance quality,	responsiveness	and	timeliness of the	judicial	system."
190,the that ensure will recommendations of the second Administrative Reforms Commission are implemented in letter and spirit d. We most forces equipment out The Indian National believes Congress modernisation of our defence is Indian imperative.
191,"The National Congress shall ensure that the process of procuring the finest, state-of- and the-art is efficiently carried and transparently, while ensuring rapid development of our domestic defence industry."
192,We will continue to protect and	advance	the	interests	of our	defence personnel and ex-servicemen.
193,"We will continue to follow an unwavering pro- India foreign policy, enhance bilateral relationships with our neighbours and friendly nations, enhance commercial ties and strive to mobilize support for permanent membership in the United Nations	Security	Council."
194,12 13 a new future for the hands that build the nation It	is	because	of the	Indian	National	Congress that employees in the organised sector have been fully protected through legislation and are entitled to social security in different ways.
195,"While organised sector employment must expand, the reality is that employment in	the	unorganised	sector	contributes	close	to 94%	of India’s	labour	force."
196,"In recent years, with the expansion of employment opportunities because of rapid economic	growth,	this	segment	has	expanded."
197,"In recognition of this, in 2008, the Congress-led UPA government	passed the Unorganised Social Workers’ Security	Act,	2008."
198,The Indian National Congress believes that it is time to scale up these programmes across the country so that all workers	derive	benefits	from	both	legislation and programmes in the next five years.
199,"To ensure a basic rights and welfare package for all working people, the Indian National Congress	will	ensure: Enforcement	of Minimum	Wage	laws; Provision	of Pension	cover; Provision of life and disability cover, health and maternity benefits – free medicine, old age protection, Provident Fund, injury benefit, housing,	education	schemes	for	children, and	old	age	homes; employment Creation	of a	working	environment	that enables all such workers to carry out work without harassment."
200,We will also ensure	humane	working	conditions; Strengthening	of collective	bargaining; Programmes for upgrading skills and improved including use of income technology.
201,"economic growth The Indian National Congress is committed to achieving 8 % growth per year, within 3 years, to be sustained over the next two decades."
202,"annum, compared to 5.9	% delivered by the NDA,	even	as	poverty	has	declined	three	times faster."
203,The growth under the Congress-led UPA	has	been	faster	and	more	inclusive	than any	earlier	period	in	India’s	history.
204,And	it	is not	just	the	acceleration	of growth	that	gives the	Indian	National	Congress	satisfaction.
205,"In keeping with the long-standing tradition of the	Indian	National	Congress,	we	have	made the growth process more socially inclusive than	it	has	ever	been."
206,"Domestic Product (GDP) by 2016-17, and	remain	below	that	level	always."
207,ii.
208,"Current Account Deficit: Our Current Account	Deficit	can	be	financed	only	by foreign	investment,	whether	it	is	Foreign Direct Investment (FDI) or Foreign Institutional Investors (FII) or External Commercial Borrowing (ECB) or any other kind of foreign inflow."
209,"Hence, there is no room for any aversion to foreign	investment."
210,iii.
211,Price Stability and Growth: The	UPA	governments’	record	on	growth	is unparalleled.
212,The deTailed aCTion plan 2014 -2019 In a developing	economy	we	must	accept	that when our aim is high growth there will be	a	moderate	level	of inflation.
213,Reserve Bank of India must strike a balance between price stability	and	growth formulating while monetary	policy.
214,iv.
215,Infrastructure: rebuild We will our infrastructure and add a huge quantity of new i n f r a s t r u c t u r e . proven Every model must be adopted.
216,The Public Private	Partnership	(PPP)	model	must	be made more transparent and competitive and more widely used.
217,New financing structures will be created for long term funds	and	pooling	of investments.
218,v. Manufacturing: We will especially focus on manufacturing on and manufacturing for export.
219,"We propose that all taxes, Central and State, which go into an exported product should be waived or rebated."
220,We also propose that there should be a minimum tariff protection	so	that	there	is	an	incentive	to manufacture goods in India rather than import	them	into	India.
221,The Indian National Congress’s agenda is one of social and economic transformation.
222,Growth is essential for this transformation to	happen	and	for	it	to	be	truly	meaningful.
223,It is economic growth that creates jobs for our youth.
224,It is economic growth that gives us	the	resources	to	invest	in	our	social	welfare programmes	and	infrastructure	development.
225,The nature and quality of growth is equally important	to	ensure	that	the	gains	of growth are	equitably	distributed.
226,"Over	the	last	ten	years,	the	Congress-led	UPA governments have pursued and delivered rapid and inclusive economic growth."
227,"We have	delivered	economic	growth	of 7.5	%	per However, given the economic slowdown in the last few years, driven by the global financial crisis, bringing India back on track to achieve 8% inclusive growth will be an overriding priority of the next Congress-led government."
228,An	Economic	Roadmap	for	2014-2019 The Finance Minister in his budget speech earlier	this	year	has	laid	out	a	roadmap	of ten important	tasks	to	be	undertaken	by	the	next government.
229,The Indian National Congress affirms its commitment to this roadmap which	is	outlined	below: i.
230,Fiscal	Consolidation:	We	will	achieve	the target of fiscal deficit of 3 % of Gross 14 15 vi.
231,"Financial Sector Reforms: The the Financial recommendations of Sector Legislative Reforms Commission that	require	no	change	in	legislation	must be	implemented	immediately	and,	for	the other	recommendations,	we	must	draw	a timetable	for	passing	legislation."
232,vii.
233,"Subsidies: Given the limited resources, and the many claims on the resources, we must choose the subsidies that are absolutely	necessary	and	give	them	only to the absolutely deserving."
234,"We will also consider introducing sensible user charges because many more people are willing	to	pay	for	better	quality	services, for example, uninterrupted power and better quality train services."
235,"We will use money this saved to expand health, education and infrastructure."
236,viii.
237,"Urbanisation: cities become Our will ungovernable, and perhaps unlivable, if we	do	not	address	the	decay	in	our	cities."
238,"Cities have wealth, cities also create wealth."
239,That	wealth	should	be	tapped	for resources	to	rebuild	the	cities	with	a	new model	of governance.
240,ix.
241,"Skill Development: Skill development must	rank	alongside	secondary	education, university	education,	total	sanitation	and universal health care in the priorities of the	government."
242,x.
243,"Sharing responsibility between States and Centre:	States	have	the	fiscal	space	to	bear	a reasonable	proportion	of the	financial	costs of implementing	flagship	programmes	and must willingly do so, so that the Central government can allocate more resources for subjects such as defence, railways, national	highways	and	telecommunications that	are	its	exclusive	responsibility."
244,"The	Indian	National	Congress’s 100	Day	Agenda	for	Growth While the above presents a medium-term agenda	for	reform,	the	immediate	priority	is to	ensure	that	the	economy	gets	back	on	track to	the	target	of 8	%	growth."
245,"While consolidating on the announcements and progress made over the last year, we following commit implementing the to and entrepreneurship opportunities for our	youth."
246,"Amend the Fiscal Responsibility and Budget Management (FRBM) Act to codify a credible commitment of the government to achieve fiscal deficit of 3 % of GDP by 2016-17, and stay below	that	always."
247,Set	up	an	independent National Fiscal Responsibility Council that will submit an annual report to the Parliament on the progress made in achieving	our	fiscal	commitments.
248,Building on the success of the Cabinet Committee	on	Investment	and	the	Project recommend environmental clearances where appropriate in a time-bound and transparent	manner.
249,"Set up a Regulatory Reform Task Force for a review of all regulatory processes of central government ministries with the intent of repealing unnecessary processes, streamlining the regulatory structures and improving ease of doing business	in	India."
250,Put	out	a	clear	policy	on	tax	treatment	of foreign	firms	and	Merger	&	Acquisitions (M & A) transactions while ensuring that taxes are paid by multinational/ foreign entities in the jurisdiction in which the profits are earned.
251,"a out Lay clear roadmap for dealing with immediate issues of public sector including banks, recapitalisation, Non-Performing Assets (NPAs), operational autonomy, human resource development and succession planning	in	each	bank."
252,Implement the recommendations of the	Financial	Sector	Legislative	Reforms Commission that require no change in legislation and lay out a timeline for passing	required	legislation.
253,The deTailed aCTion plan 2014 -2019 agenda	within	100	days	of forming	the	next government: Introduce the Goods and Services Tax (GST)	Bills	in	Parliament	and	ensure	they are	enacted	within	1	year.
254,"GST	is	likely	to increase	the	aggregate	revenue	which	will be used to fund the extra investment in infrastructure,	health	and	education."
255,Ensure	that	we	are	on	track	to	pass	a	new Direct	Tax	Code	Bill	in	the	first	year	of the	new	Lok	Sabha.
256,"Announce a detailed Jobs Agenda to ensure	that	we	create	10	crore	new	jobs Monitoring Group in clearing stalled investment proposals, set up a National Investment Facilitation Authority, a permanent body headed by the Prime Minister, and supported by a full-time secretariat,	with	the	explicit	mandate	of identifying	delayed	projects	and	resolving inter-ministerial	issues	to	enable	rapid	and transparent approvals to large projects, especially	in	the	infrastructure	sector."
257,Bring a Bill to set up a National Environmental	Appraisal	and	Monitoring Authority	to	conduct	rigorous	and	time- bound environmental appraisals and Accelerating	Job	Creation	and	Skill Development The ‘National Manufacturing landmark Policy’	of the	UPA	government	brought	the 16 17 agenda	of job	creation	and	manufacturing	led growth on the policy landscape.
258,This policy incorporates	the	agenda	of creating	10	crore jobs	in	the	manufacturing	sector	alone	within one decade.
259,"Today,	two-thirds	of Indians,	nearly	80	crore Indians, are below 35 years of age."
260,"Getting well	paying,	decent	jobs	or	entrepreneurship opportunities as they enter working age, is their	number	one	priority."
261,"While	a	number	of steps	have	been	taken	in	this	direction	in	the last	decade,	this	remains	an	overriding	national priority,	requiring	a	lot	more	to	be	done."
262,The Indian National Congress will announce a Jobs	Agenda	within	100	days	of forming	the government.
263,This agenda	will	include the following elements: The Indian N a t i o n a l is Congress c o m m i t t e d creation to industrial of c o r r i d o r s catalyze to economic growth and give a focused thrust	to	manufacturing	in	the	country.
264,Create 100 new urban clusters around existing	small	and	emerging	cities	and	link them	with	power	and	transport	facilities to	scale	existing	economic	activities.
265,4. rate investment to Increase India’s 38 % to ensure more new investments are	made	to	create	jobs.
266,"‘Ease of Doing Improving India’s Business’ ranking from the current 134 to	75	within	5	years,	by	streamlining	the process for starting a business, getting various permits, easing access to credit, streamlining	the	tax	enforcement	system, and	various	other	interventions."
267,and a robust monitoring system will be put	in	place	to	track	the	manner	in	which skills	are	imparted	and	certifications	given at	the	ground	level	under	this	scheme.
268,enacted	several	laws	to	protect	their	interests including the Unorganised Workers’ Social Security Act.
269,We will ensure the effective implementations	of all	such	laws.
270,Create an enhanced framework to promote exports.
271,"Waive off all taxes, Central	and	State,	that	go	into	exported products."
272,tariff protection	so	that	there	is	an	incentive	to manufacture goods in India rather than import	them.
273,Put a minimum Community colleges at stand the crossroads of higher education and the real	world.
274,We	have	begun	a	programme to convert 200 existing educational institutions into community colleges.
275,This	will	be	completed	within	5	years.
276,"The Congress-led UPA government, being fully aware of the importance of skilling to increase employability set up the	National	Skills	Development	Agency The	Indian	National	Congress	is	committed to the creation of new and upgrading of existing Industrial Training Institutes (ITIs)."
277,Recognising the need to have The	Indian	National	Congress	will	ensure health	insurance	as	well	as	pension	cover for	this	group.
278,"The Indian National Congress is committed	to	the	strictest	implementation of Contract (Regulation and Abolition) Act of 1970, to end exploitation of workers and to improve their	welfare	and	working	conditions."
279,Labour The deTailed aCTion plan 2014 -2019 We will focus specially on working labour in hazardous industries.
280,"Aadhaar a powerful for the migrant is tool protecting interests of labour, as well as ensuring the smooth flow of remittances	to	their	families."
281,"All	migrant labour	will	be	covered	under	the	Aadhaar programme	in	the	next	one	year,	through a	special	campaign."
282,"The special needs of labour working in plantations, particularly those relating to housing, will be addressed through ongoing	programmes."
283,"The Unorganised Workers’ Social Security	Act,	2008	has	been	enacted;	this will	be	implemented	in	letter	and	spirit."
284,"to coordinate various disparate training efforts of different Central government ministries, State governments, industry, etc."
285,We commit the resources	at	its	disposal	and	enhance	its mandate.
286,"increasing to Reform the Apprentice Act, 1961, to encourage	more	firms	to	hire	apprentices in	their	firms,	which	has	proven	to	be	a very	effective	way	of providing	“on-the- job	training”	to	new	employees."
287,"The Standard Training Assessment and Reward (STAR) Scheme set up by the UPA government will be better funded quality world-class training methods and infrastructure,	we	will	introduce	incentives for	Public	Private	Partnership	and	engage world	class	expertise	to	ensure	our	youth are best equipped to take on demanding jobs	in	today’s	globalized	world."
288,"protecting the interests of labour The Indian National Congress will extend social	security	to	the	entire	labour	class,	both organised	and	unorganised."
289,The Indian National Congress has stood for the cause and rights of labour.
290,We have 18 19 We	will	set	up	a	Commission	to	explore the possibility of bringing all Labour Laws	under	one	comprehensive	Law.
291,right to health The Indian National Congress will increase health expenditure to 3% of GDP and provide	universal	and	quality	health	care	for all	Indians.
292,The	Indian	National	Congress	has	endeavoured to	provide	quality	public	health	services	to	all citizens.
293,Its forward-looking Schemes have achieved	great	success.
294,This	is	reflected	in	the decline in the Maternal Mortality Ratio and Infant Mortality Rate.
295,"The Janani Suraksha Yojana, a scheme started	to	encourage institutional	delivery has achieved great success	in	increasing of number the beneficiaries from 7.3	lakh	in	2005-06, to nearly 113 lakh pregnant women in 2010-11."
296,"The Indian National Congress will expand the Rashtriya Swasthya Bima Yojana to enable access to a continuum of comprehensive primary, secondary and	tertiary	care."
297,The Indian National Congress commits itself to increasing the Institutional Delivery	Rate.
298,Maternal	and	child	health care will also continue to be a major focus.
299,We aim to reduce the Infant Mortality Rate and Maternal Mortality Ratio	drastically.
300,Almost	56%	of adolescent	girls	in	India	are anaemic.
301,Anaemia	and	malnutrition	among comprehensive care and support to all persons	living	with	HIV/AIDS.
302,"We will launch focused intervention to improve the Child Sex Ratio, within an overall “National Strategy for Care and Protection	of the	Girl	Child”	from	birth to adolescence."
303,Health and Family Welfare	Programmes will be strengthened to achieve a Total Fertility	Rate	(TFR)	of 2.1	between	2017 and	2020.
304,Particular	attention	will	be	paid to regions which still have a high TFR (above	2.5).
305,(AWWs) Anganwadi Workers and Community Health Officers etc.
306,We will work to fill the current vacancies and competencies their through nationwide capacity building programmes linked to the National Health	Mission.
307,"improve We will create 6o lakh new jobs in the health sector by 2020 by training and expanding the current teaching programmes	for	healthcare	professionals, particularly sector institutions."
308,We will start a three-year Diploma	Course	in	Public	Health.
309,the public in The deTailed aCTion plan 2014 -2019 Primary health care infrastructure will	be	strengthened right	upto	the	point of the community health centre and continuity of care would	be	assured.
310,We were the first party to implement development policies as human rights.
311,"To strengthen	this	framework,	we	now	pledge to enact a Right to Health to ensure that all people obtain easily accessible, quality health services, based on a combination of public provision and social insurance."
312,The new National Health Mission will emphasize	both	rural	and	urban	health	care.
313,"We will provide for 5 state of the art mobile health care vans in every district, equipped with x-ray and other equipment,	to	provide	health	care	check ups including, mammography, blood tests,	etc."
314,mothers	endanger	the	mother’s	health	and causes	growth	retardation	and	vulnerability to diseases in children.
315,This is not just a socio-economic challenge; it is a political challenge to which the Indian National Congress	reaffirms	its	commitment.
316,Almost 60% of open defecation in the world	takes	place	in	India.
317,Poor	sanitation is a serious health hazard.
318,We will endeavour to provide a functional toilet in	every	school	and	every	household.
319,There	has	been	a	reduction	of new	HIV infections in the country by 57%.
320,We aim to reduce this further and provide India’s success in becoming polio-free through vaccination will be replicated.
321,Our	goal	is	to	ensure	universal	coverage of through campaigns and effective monitoring in districts	throughout	the	country.
322,"immunization routine To ensure effective implementation of all health related initiatives, we will work to strengthen the primary health workforce including Accredited (ASHAs), Social Health Activists Auxiliary Nurse Midwives (ANMs), Male Multipurpose Workers (MMWs), empowering scheduled Castes, scheduled Tribes and other backward Classes The Indian National Congress will continue to work towards the empowerment of the marginalised	sections	of society."
323,The principles of equity and inclusion have been weaved into the very fabric of the Indian	National	Congress.
324,"It	is	because	of the initiatives of the Indian National Congress that the Scheduled Castes, Scheduled Tribes and Other Backward Classes have seen 20 21 improvement an in key socio-economic indicators."
325,In	fact	the	annual	rate	of decline for poverty in the period between 2004–05 and 2009–10 has been much higher than between	1993-94	and	2004-05	for	Scheduled Castes	and	Scheduled	Tribes.
326,"The Indian National Congress has enacted several	laws	for	the	weaker	sections	including the	Manual	Scavengers	and	their	Rehabilitation Act, 2013 to push for rehabilitation of (117th these families."
327,The Constitution Amendment)	Bill	2012	to	provide	reservation in promotions for Scheduled Castes and Scheduled	Tribes	has	been	passed	by	the	Rajya Sabha.
328,"We will continue to fight the deep- seated prejudices, t r a d i t i o n a l and hierarchies disparities faced by these sections, socially, politically and	economically."
329,"The Indian N a t i o n a l is Congress committed to finding a way forward for introducing reservation	in	education	and	employment for economically weaker sections of all communities	without	in	any	way	affecting for Scheduled existing Castes, Scheduled Tribes and Other Backward	Classes."
330,reservations We	now	pledge	to	enact	central	legislation on the Scheduled Castes and Scheduled Tribes	Sub	Plans	so	that	the	development of Scheduled Castes and Scheduled Tribes can be accelerated to become at par	with	other	Castes.
331,"The Indian National Congress will ensure the passage of the Scheduled Castes	and	Scheduled	Tribes	(Prevention of Atrocities)	Amendment	Bill,	2013."
332,"With a strong focus on education and vocational skills, we will endeavour to establish one Navodaya Vidyalaya type of school of high standards for weaker sections,	in	every	Block	of the	country."
333,"We will continue to provide assistance to fund the cost of education in both private and government institutions for Scheduled Caste and Scheduled Tribe students,	with	priority	to	those	students pay	for	the	appropriate	skill	development course."
334,The	Indian	National	Congress	has	ensured the reservation of 4% of procurement from	small	and	medium	Scheduled	Caste and Scheduled Tribe enterprises.
335,We will push for strict implementation of this norm.
336,"The Indian National Congress, recognizing that dalit women are more socially	and	economically	vulnerable,	has endeavored	to	work	for	their	upliftment and welfare and will continue to ensure dignity through economic and social empowerment."
337,The Indian National Congress is committed	to	creating	national	consensus on affirmative action for Scheduled Castes and Scheduled Tribes in the private	sector.
338,We will take steps to ensure that all reserved	posts	are	filled	and	a	special	drive will	be	undertaken	to	fill	all	the	backlog vacancies	in	reserved	posts	in	government and	Public	Sector	Undertakings.
339,"The	Indian National Congress is	deeply committed to developing a National Action Plan for the Development of Scheduled Castes, Scheduled Tribes and Other Backward Classes."
340,"There	shall be	a	special	survey, which will be undertaken once every five years to estimate, on select	development indicators, the gap in	the	development of these	groups."
341,The deTailed aCTion plan 2014 -2019 whose	parental	income	is	less	than	₹	6 lakh	per	annum.
342,All	Scheduled	Caste	and	Scheduled	Tribe students fulfilling the admission criteria will	be	provided	with	universal	access	to the Rajiv Gandhi Research Fellowships.
343,"In addition, 1000 overseas scholarships for eligible students will be provided annually."
344,"Every Scheduled Caste or Scheduled Tribe unemployed graduate or post graduate will be provided with a Skill Development Voucher of ₹ 10,000 to We	will	encourage	and	support	Scheduled Caste	and	Scheduled	Tribe	entrepreneurs by providing them easy access to credit and other incentives like tax rebates at the initial stages of establishment of their	business	etc."
345,and creating We will focus on development activities economic social for opportunities for Scheduled Tribes.
346,"We will	ensure	the	stringent	implementation of PESA, 1996 and the Forest Rights Act, 2006 to ensure that Scheduled Tribes are empowered	and	brought into the mainstream."
347,The Indian National Congress will ensure that the existing Rajiv Gandhi National	Fellowship	for	Scheduled	Caste and Scheduled Tribe Candidates will be extended	to	students	belonging	to	Other Backward	Classes.
348,"The Indian National Congress will establish Special Commissions for Scheduled Castes, Scheduled Tribes and Other Backward Classes to identify communities within each group which have	not	benefited	from	reservations	and other	affirmative	action	programmes	and which	need	to	be	given	a	special	focus."
349,22 23 Women’s empowerment and protection of Children The Indian National Congress will ensure the safety and security of our women and children.
350,"We	will	provide	them	equal	access	to social,	economic	and	political	opportunities."
351,The	Indian	National	Congress	is	a	party	that has	gone	beyond	the	rhetoric	and	hyperbole relied on by most parties when it comes to the empowerment of women and children.
352,"The Indian National Congress has enacted several women and child oriented Acts, including the Criminal Law (Amendment) Bill, the 2013, Sexual Harassment at of Women Workplace	(Prevention, Prohibition and Redressal)	Act,	2013, the Criminal Law (Amendment) Act, 2013, Commission for Protection of Child Rights Act, 2005, and the Protection of Children from Sexual Offences Act, 2012."
353,We have also ensured that gender equality and child care facilities are mainstreamed in government schemes like MGNREGA.
354,We will continue to	work	for	the	development	our	women	and children.
